HP_ID,info
HP:0012869,acephalic spermatozoa specimen
HP:0012218,alveolar soft part sarcoma
HP:0008648,"an anteriorly displaced urethral meatus is a congenital condition where the opening of the urethra, the tube that carries urine out of the body, is located on the underside of the penis instead of at the tip."
HP:0004535,anterior cervical hypertrichosis lanugo
HP:0011604,aortopulmonary window malformation
HP:0011604,aortopulmonary window shunt
HP:0025534,"benign corkscrew-like episcleral vessels"""
HP:0025534,"bilateral ocular melanocytosis"""
HP:0030988,bile ducts exhibiting granulomatous cholangitis
HP:0010474,bladder stones manifestation
HP:0030915,brainstem compression due to cerebellar edema
HP:0100757,childhood pancreatic mass: pancreatoblastoma
HP:0011504,chloroquine-induced bull's eye maculopathy
HP:0100883,chorangioma: a benign vascular anomaly in the placenta
HP:0030988,chronic antigen exposure leading to granulomatous cholangitis
HP:0025387,classic pill-rolling tremor
HP:0040317,clinical manifestation: blue urine
HP:0100628,clinically significant esophageal diverticulum
HP:0011761,clinically silent pituitary adenoma
HP:0025534,congenital ocular melanocytosis
HP:0007765,disproportionately deep anterior chamber
HP:0007475,"distinctive features include blistering, erosions, and peeling at birth"
HP:0012219,drug-induced erythema nodosum
HP:0011769,ectopic parathyroid gland location
HP:0011755,ectopic posterior pituitary lobe
HP:0100241,ectopic respiratory mucosa in cutaneous tissue
HP:0025078,electrocardiogram with electrical alternans
HP:0025078,electrocardiographic pattern of electrical alternans
HP:0100296,evident perifascicular muscle fiber atrophy
HP:0100757,extremely rare pancreatic malignancy: pancreatoblastoma
HP:0100610,fetal exposure to maternal hyperphenylalaninemia
HP:0025480,gluteal cleft lipomyelomeningocele
HP:0100883,growth of blood vessels in a hamartomatous fashion in the placenta
HP:0004535,hereditary anterior cervical hypertrichosis
HP:0011761,hormonally silent pituitary adenoma
HP:0007475,"hyperkeratotic scaling in joint flexures, hands, and feet"
HP:0100661,idiopathic trigeminal neuralgia
HP:0012219,immune-mediated dermatosis
HP:0100673,impalpable testes due to vaginal hydrocele
HP:0011555,incomplete right ventricular development with double inlet left ventricle
HP:0012219,infection-associated erythema nodosum
HP:0040313,intermittent oligoarthritis
HP:0100726,kaposi's sarcoma-associated herpesvirus skin manifestations
HP:0100726,kaposi's sarcoma: a multisystem disease driven by hhv8
HP:0008659,medullary cystic disease manifestation
HP:0011572,membranous supravalvular mitral stenosis
HP:0007792,"microsaccadic pursuit refers to rapid, small-magnitude eye movements that occur during attempted fixation or smooth pursuit."
HP:0100661,microvascular trigeminal neuralgia
HP:0100814,mongolian spot observed at birth
HP:0012619,multiple bladder diverticula sacs
HP:0100877,narrow-necked renal diverticulum
HP:0100792,"nikolsky's sign, positive"
HP:0011761,non-functional pituitary adenoma
HP:0011572,obstructive supravalvular mitral ring
HP:0025274,ovarian dermoid cyst with epidermal components
HP:0025387,parkinson's pill-rolling tremor
HP:0025387,parkinsonian pill-rolling tremor
HP:0100628,pathological condition characterized by an esophageal pouch
HP:0030863,pathological nasal flaring
HP:0100757,pediatric-specific pancreatic malignancy: pancreatoblastoma
HP:0011608,persistent truncus arteriosus type ii: two distinct pulmonary artery origins
HP:0100883,placental chorangioma mass
HP:0030856,posterior staphyloma due to scleral alterations
HP:0100296,predominant perifascicular muscle fiber atrophy
HP:0100610,pregnancy complicated by maternal hyperphenylalaninemia
HP:0100628,presence of an esophageal pouch
HP:0100883,presence of chorangioma in the maternal placenta
HP:0008659,presence of medullary sponge kidney disease
HP:0100005,primary testicular mesothelioma
HP:0100726,"purple, reddish-blue, or brown skin nodules"
HP:0012063,radiographic feature of aneurysmal bone cyst
HP:0030880,raynaud's phenomenon-like symptoms
HP:0100661,secondary trigeminal neuralgia
HP:0011761,silent pituitary adenoma
HP:0025452,skin lesion progressing to pyoderma gangrenosum
HP:0007475,subsequent development of hyperkeratotic scaling along joints and pressure-sensitive areas
HP:0011572,supravalvular mitral ring anomaly
HP:0011572,supravalvular mitral ring deformity
HP:0100726,systemic malignancy with cutaneous and visceral involvement
HP:0040313,transient oligoarthritis
HP:0011610,type 4 truncus arteriosus with significant shunting
HP:0011608,type ii truncus arteriosus: pulmonary arteries branching from truncus posteriorly/laterally
HP:0011608,type ii truncus arteriosus: two distinct pulmonary artery origins
HP:0011608,type ii truncus arteriosus: two separate pulmonary artery origins
HP:0011477,upbeat nystagmus in primary gaze
HP:0025534,"uveal melanocytosis"""
HP:0100673,vaginal hydrocele causing testicular impalpability
HP:0100726,vascular tumors due to kaposi's sarcoma-associated herpesvirus
HP:0011372,absent inner ear structures
HP:0000845,acromegaly in adults
HP:0003344,3-hydroxy-3-methylglutaric aciduria
HP:0003535,3-methylglutaconic aciduria confirmation in urine
HP:0003535,3-methylglutaconic aciduria detected in urinalysis
HP:0003344,3-methylglutaric aciduria diagnosis
HP:0003161,4-hydroxyphenylpyruvic aciduria diagnosis
HP:0040278,a benign tumor of the pituitary gland
HP:0010603,"a benign uni- or multicystic, intraosseous tumor of odontogenic origin, with a characteristic lining of parakeratinized stratified squamous epithelium and potential for aggressive, infiltrative behaviour."
HP:0034303,a bifid t-wave with a notch duration between the 2 peaks at leasy 0.04 sec and an amplitude at least 0.05 mv.
HP:0025190,a bilateral tonic-clonic seizure with generalized onset is a type of bilateral tonic-clonic seizure characterised by generalized onset; these seizures rapidly engage networks in both hemispheres at the start of the seizure.
HP:0032227,"a common, benign skin condition involving hypertrophy of the sebaceous glands characterized by single or multiple lesions that manifest as yellow, soft, small papules with umbilication. the lesions are located commonly on the central face but may also occur elswehere, including the chest, mouth, scrotum, foreskin, penile shaft, vulva, and areola."
HP:0001171,a condition in which middle parts of the hand are missing giving a cleft appearance. the severity is very variable ranging from slightly hypoplastic middle fingers over absent middel fingers as far as oligo- or monodactyl hands.
HP:0001015,a condition in which superficial veins are more conspicuous or noticable than normal.
HP:0032514,a congenital developmental anomaly characterized by the presence of two lacrimal punctum on one or both sides of the face.
HP:0025105,a congenital skin lesion characterized by irregular hypopigmented macules that coalesce to form plaques and occur particularly on the chest. it is generally present at birth or develops in the first days of life. it is more common in females. diagnosis is confirmed by applying gentle friction to the lesion and the surrounding skin and checking that the erythema produced in the healthy skin does not appear in the hypopigmented lesion. this pale macule becomes more conspicuous when the lesion and its surroundings are rubbed. the margin of the naevus is ill-defined and consists of an archipelago of small anaemic spots.
HP:0034302,a congenitally anomalous enlarged optic disk . it is considered to be a normal variant without physiological defects.
HP:0500070,"a conjuctival lesion composed of adipose tissue and dense connective tissue. such choristomas of dermal elements are normally found at the outer canthus, and have a gelatinous appearance. classically, there is an indistinct posterior border and a well-demarcated anterior border several millimetres posterior to the limbus."
HP:5200053,a consistent failure to nonverbally respond to verbal cues such as a failure to shift attention or look at the source of the cue.
HP:5200036,a consistent failure to respond to any verbal cues.
HP:5200054,a consistent failure to verbally respond to verbal cues which are intended to elicit a verbal response.
HP:0032674,"a cutaneous wound is a defined as a disruption of normal anatomic structure and function of the skin that occured owing to an injury of the skin. wound healing is a dynamic, interactive processinvolving soluble mediators, blood cells, extracellularmatrix, and parenchymal cells. wound healing has three phases: inflammation, tissue formation, and tissue remodeling, that overlap in time."
HP:0034408,"a dark, keratotic papule about 2-10 mm in diameter, usually occuring on the lower extremeities. usually the lesions begin as bright, soft, and nonkeratotic paules which grow larger and change to a firm, blue to black and keratotic stage."
HP:5200320,a decrease in frequency or duration related to seeking or maintaining relationships may involve avoiding social outings or social interactions.
HP:5200310,"a decrease in the frequency, intensity, or extent of social or personal exchanges between individuals."
HP:0500162,a decreased amount of carnosine in bood.
HP:0020175,a decreased amount of cholinesterase in the blood circulation.
HP:0020222,a decreased concentration of homocystine in the blood.
HP:0045041,a decreased or reduced level of the enzyme lactate dehydrogenase in serum.
HP:0031433,"a deficit in emotional awareness is characterized by difficulties in recognizing and expressing feelings and emotions. this deficit manifests as a limited ability to respond to facial cues or other signs of emotions in others, often accompanied by detached connections to others."
HP:5200420,"a delusion is when someone believes they are loved by another person, even though there is no evidence of this, and the person in question denies it."
HP:0030715,a developmental anomaly characterised by focal obliteration of the proximal segment of a bronchus. the bronchial pattern is entirely normal distal to the site of stenosis.
HP:0100841,a developmental anomaly wtih a small tubular or saccular midline stomach.
HP:0034548,a developmental defect characterized by underdevelopment of hte portal vein.
HP:0034530,"a developmental defect of a long bone, such as the femur or the humerus, characterized by a sharply curve deviation located in the metaphysis of the bone."
HP:0001180,a developmental defect resulting in the presence of fewer than the normal number of fingers.
HP:0011545,a deviance in the normal connections between two cardiac segements.
HP:0012113,"a deviation from the normal concentration of creatine in the blood circulation. creatine is a derivative of glycine having methyl and amidino groups attached to the nitrogen. creatine is naturally produced from amino acids, primarily in liver and kidney, and acts as an energy source for cells, primarly for muscle cells."
HP:0034582,a deviation from the normal distribution of cell types or their relative proprotions in a lymph node.
HP:0011146,a dialeptic seizure is a type of seizure characterised predominantly by reduced responsiveness or awareness and with subsequent at least partial amnesia of the event.
HP:0005787,a flattened vertebral body shape with reduced distance beween the vertebral endplates affecting the lumbar spine.
HP:0004592,a flattened vertebral body shape with reduced distance beween the vertebral endplates affecting the thoracic spine.
HP:0032755,a focal autonomic seizure characterised by impaired awareness at some point within the seizure.
HP:0032790,a focal behavior arrest seizure characterised by impaired awareness at some point during the seizure.
HP:0032789,a focal behavior arrest seizure characterised by retained awareness throughout the seizure.
HP:0032858,a focal motor seizure with negative myoclonus characterized by impairement of awareness at some point during the seizure.
HP:0100025,a form of hypersociability that presents as mostly inappropriate people-orientation and friendliness towards others on an inadequate level which might go as far as being dangerous considering for example young children following strangers without restriction.
HP:0033423,a form of pulmonary arterial hypertension in which there is a reduction of mean pulmonary artery pressure at leasy 10 mmhg to reach an absolute value of mpap not more than 40 mmhg with an increased or unchanged cardiac output in response to inhaled nitric oxide at 10-20 ppm.
HP:0033349,"a fourfold or greater increase of usual seizure frequency within a 3-day period, where the patient demonstrates full recovery between seizure events within the cluster. the seizure cluster should be recognisable by the primary clinician, carer or patient."
HP:0000204,a gap in the upper lip. this is a congenital defect resulting from nonfusion of tissues of the lip during embryonal development.
HP:0002123,"a generalized myoclonic seizure is a type of generalized motor seizure characterised by bilateral, sudden, brief involuntary single or multiple contraction of muscles or muscle groups of variable topography . myoclonus is less regularly repetitive and less sustained than is clonus."
HP:0032795,"a generalized myoclonic-tonic-clonic seizure is a type of generalized motor seizure characterised by a single or multiple jerks of limbs bilaterally, followed by tonic and clonic phases. the initial jerks can be considered to be either a brief period of clonus or myoclonus."
HP:0002121,"a generalized non-motor seizure is a type of a type of dialeptic seizure that is of electrographically generalized onset. it is a generalized seizure characterised by an interruption of activities, a blank stare, and usually the person will be unresponsive when spoken to. any ictal motor phenomena are minor in comparison to these non-motor features."
HP:0010818,"a generalized tonic seizure is a type of generalized motor seizure characterised by bilateral limb stiffening or elevation, often with neck stiffening without a subsequent clonic phase. the tonic activity can be a sustained abnormal posture, either in extension or flexion, sometimes accompanied by tremor of the extremities."
HP:0000683,a grey discoloration of the dental enamel.
HP:0032538,a groove or crease on the shins . pretibial creases may be obvious at birth and may range from 3 cm to over 15 cm in length and lenghten as the limb grows. they appear as an elongated dimple because of the attachment of skin to underlying tissue . the dimple or crease grows in proportion to the growth of the leg.
HP:0500091,a hamartoma of lymph vessels that usually presents in childhood. it tends to increase in size with head-down posture and with the valsalva manoeuvre. superficial lesions are visible as transilluminable cystic spaces of the lid or conjunctiva that may also contain blood. deep lesions may cause gradual proptosis or present acutely with orbital pain and reduced vision due to haemorrhage.
HP:0035011,a history of exposure to silver that has occured in relation to performance of job duties.
HP:0010962,a kind of bronchopulmonary sequestration that is completely discrete from the normal lung and is surrounded by separate pleura.
HP:0010961,a kind of bronchopulmonary sequestration that is incorporated into the normal surrounding lung.
HP:0012526,a lack of platelet alpha granules. this typically results in the grey appearance of platelets in giemsa stained blood smears.
HP:0031678,"a lesion associated with atherosclerosis, a multifactorial and multipart progressive disease manifested by the focal development within the arterial wall of lesions, that ranges from teh development of a fatty streak, plaque progression, and plaque disruption. atherosclerotic lesions demonstrate consistent morphological characteristics, which indicate that each type may stabilize temporarily or permanently and that progression to the next type may require an additional stimulus."
HP:0034392,"a limitation in the passive range of motion of the elbow resulting from loss of elasticity in the periarticular tissues owing to structural changes of non-bony tissues, such as muscles, tendons, ligaments, joint capsules or skin. a contracture prevents movement of the associated body part."
HP:0006858,a loss or impairment of the sensation of the relative position of parts of the body and joint position occuring at distal joints.
HP:0011956,"a lymphoproliferative abnormality of the intestine characterized by numerous visible mucosal nodules measuring up to, and rarely exceeding, 0.5 cm in diameter histologically, hyperplastic lymphoid follicles with large germinal centres are seen in the lamina propria and superficial submucosa. there is enlargement of the mucosal b cell follicles caused by hyperplasia of the follicle centres; surrounded by a normal appearing mantle zone. disease may involve the stomach, the entire small intestine, and the large intestine."
HP:0008572,a malformation of the auricle of the ear.
HP:0032794,"a myoclonic seizure is a type of motor seizure characterised by sudden, brief involuntary single or multiple contraction of muscles or muscle groups of variable topography . myoclonus is less regularly repetitive and less sustained than is clonus."
HP:0025392,"a nodular pattern is characterised on pulmonary high-resolution computed tomography by the presence of numerous rounded opacities that range from 2 mm to 1 cm in diameter, with micronodules defined as smaller than 3 mm in diameter."
HP:0000543,a pale yellow discoloration of the optic disk . the optic disc normally has a pinkish hue with a central yellowish depression.
HP:0041154,a partial or complete breakage of the elbow joint.
HP:0001678,a patient experiencing an interruption of electrical communication between the upper and lower chambers of the heart is said to be suffering from atrioventricular block.
HP:0002044,a patient was diagnosed with zes characterized by multiple pancreaticoduodenal gastrinomas with ulceration.
HP:0005449,"a patient with a bridged sella turcica may exhibit asymptomatic symptoms or exhibit a range of symptoms depending on the size and location of the bone bridge filling the normal gap in the sella turcica, which houses the vital pituitary gland responsible for secreting essential hormones."
HP:0003990,"a patient with a congenital ulna deformity, a birth defect resulting in an abnormally pointed ulna bone, experiences complications in bone alignment and movement."
HP:0003990,"a patient with a pointed ulna bone, characterized by a pointed end instead of a flat end, experiences difficulties with bone articulation and functioning due to this anatomical variation."
HP:0008648,"a patient with an ectopic urethra has a urethra that has developed in the wrong place, characterized by an anteriorly displaced urethral meatus, resulting in an abnormal opening of the urethra."
HP:0000013,a patient with congenital uterine hypoplasia is born with an abnormally small uterus.
HP:0007348,a patient with hypoplasia of the pyramidal tract may exhibit varying degrees of motor impairment due to the reduced transmission of motor signals from the brain to the spinal cord.
HP:0002023,"a patient with imperforate anus is born without a fully formed anus, requiring surgical intervention to create a functional opening for bowel movements."
HP:0003990,"a patient with pointed ulna syndrome exhibits a congenitally deformed ulna bone, which causes impaired bone alignment and restricted mobility, substantially impacting their daily functioning and overall quality of life."
HP:0002035,a patient with rectal prolapse experiences a protrusion of the rectum through the anus.
HP:0005576,"a progressive detrimental connective tissue deposition on the kidney parenchyma involving the tubules and interstitial tissue of the kidney. tubulointerstitial injury in the kidney is complex, involving a number of independent and overlapping cellular and molecular pathways, with renal interstitial fibrosis and tubular atrophy as the final common pathway. however, if and ta are separable, as shown by the profound ta in renal artery stenosis, which characteristically has little or no fibrosis . for new annotations it is preferable to annotate to the specific hpo terms for renal interstitial lfibrosis and/or renal tubular atrophy."
HP:5200026,a reduced ability to imitate a task or the movements of others.
HP:0012760,"a reduced ability to participate in the back-and-forth flow of social interaction appropriate to culture and developmental level, which is normally characterized by an influence of the behavior of one person on the behavior of another person."
HP:0032025,"a reduced concentration of circulating alpha-1 antitrypsin, which is a 52-kda glycoprotein mainly synthesised and secreted by hepatocytes into the bloodstream. alpha-1 antitrypsin is a serine-proteinase inhibitor that it is crucial in maintaining protease-antiprotease homeostasis in the lungs."
HP:0031100,a reduced concentration of inhibin b in the blood.
HP:0031085,"a reduced concentration of prealbumin in the blood. prealbumin, also known as transthyretin, has a half-life in plasma of about 2 days, much shorter than that of albumin. prealbumin is therefore more sensitive to changes in protein-energy status than albumin, and its concentration closely reflects recent dietary intake rather than overall nutritional status."
HP:0100503,a reduced concentration of vitamin b1.
HP:0100504,a reduced concentration of vitamin b2.
HP:0100505,a reduced concentration of vitamin b5.
HP:0100506,a reduced concentration of vitamin b8.
HP:0100510,a reduced concentration of vitamin c.
HP:0100512,a reduced concentration of vitamin d.
HP:0011892,a reduced concentration of vitamin k.
HP:0034011,"a reduced proportion of sperm that move in a straight line or large circles; alternatively, an increaed proportion of sperm that move in tight circles or in some other non-linear fashion."
HP:0033452,a reduction from the normal concentration of prealbumin in the blood circulation.
HP:5200037,"a reduction in showing sympathy to others, such as providing comfort when someone is sad or crying."
HP:0000897,"a row of beadlike prominences at the junction of a rib and its cartilage , resembling a rosary."
HP:0010822,"a scintillating scotoma is a common visual aura that can preced a migraine, whereby a spot of flickering light near the center of the visual fields occurs. the spot prevents vision, and is thus termed scotoma. the scotoma can extend into one or more shimmering arcs of white or colored flashing lights."
HP:0011165,"a seizure characterized by elementary visual hallucinations such as flashing or flickering lights/colours, or other shapes, simple patterns, scotomata, or amaurosis as its first clinical manifestation."
HP:0032851,"a seizure characterized by elementary visual hallucinations such as flashing or flickering lights/colours, or other shapes, simple patterns, scotomata, or amaurosis."
HP:0001250,a seizure is an intermittent abnormality of nervous system physiology characterised by a transient occurrence of signs and/or symptoms due to abnormal excessive or synchronous neuronal activity in the brain.
HP:5200402,"a solitary belief that can be considered justified in the context of a person's life history and personality, but which goes on to determine an individual's actions to a morbid degree. the disturbance in functioning and the subjective suffering caused to the patient or others give this type of idea the qualifier of being overvalued."
HP:0025428,a spasm of the bronchioles.
HP:0011340,"a subtle unilateral cleft of the upper lip, which may appear as a small indentation."
HP:0032055,a subtype of focal cortical dysplasia type iii that is characterized by alterations in architectural organisation or cytoarchitectural composition in patients with hippocampal sclerosis .
HP:0031805,a subtype of fundus hemorrhage occurring within the neurosensory retina. intraretinal haemorrhages may be 'dot' or' blot' shaped or flame shaped depending upon their depth within the retina.
HP:0034880,a swelling or enlargment localized to the adrenal gland. the word mass is usually used at an early stage of the diagnostic workup before the precise nature of the swelling has been determined.
HP:0034884,a swelling or enlargment localized to the cervis of the uterus. the word mass is usually used at an early stage of the diagnostic workup before the precise nature of the swelling has been determined.
HP:0034972,a swelling or enlargment localized to the fallopian tube. the word mass is usually used at an early stage of the diagnostic workup before the precise nature of the swelling has been determined.
HP:0034879,a swelling or enlargment localized to the ovary. the word mass is usually used at an early stage of the diagnostic workup before the precise nature of the swelling has been determined.
HP:0034971,a swelling or enlargment localized to the peritoneal cavity. the word mass is usually used at an early stage of the diagnostic workup before the precise nature of the swelling has been determined.
HP:0034963,a swelling or enlargment localized to the ureter. the word mass is usually used at an early stage of the diagnostic workup before the precise nature of the swelling has been determined.
HP:0034968,a swelling or enlargment localized to the urinary bladder. the word mass is usually used at an early stage of the diagnostic workup before the precise nature of the swelling has been determined.
HP:0034881,a swelling or enlargment localized to the uterus. the word mass is usually used at an early stage of the diagnostic workup before the precise nature of the swelling has been determined.
