HP_ID,info
HP:0005575,the patient presented with a diagnosis of dysregulated complement-mediated hemolytic uremic syndrome .
HP:0000031,"the patient presented with a diagnosis of epididymitis, characterized by inflammation of the epididymis."
HP:0000471,"the patient presented with a diagnosis of gastrointestinal angiodysplasia, characterized by abnormal, dilated blood vessels in the lining of the gastrointestinal tract."
HP:0000794,"the patient presented with a diagnosis of iga nephropathy, characterized by the deposition of iga immune complexes in the mesangial region of the kidneys."
HP:0001894,"the patient presented with a diagnosis of thrombocytosis, characterized by an overproduction of platelets."
HP:0008826,"the patient presented with a femoral head subluxation, characterized by a partial dislocation of the femoral head from the acetabulum."
HP:0003978,the patient presented with a fractured radius that required immediate medical attention.
HP:0007459,"the patient presented with a generalized inability to sweat, a condition characterized by an impaired thermoregulatory response."
HP:0003716,"the patient presented with a generalized muscular appearance from birth, characterized by a uniform distribution of muscle mass throughout their body."
HP:0000551,"the patient presented with a loss in color vision, characterized by difficulty distinguishing between certain hues."
HP:0001903,"the patient presented with a low number of red blood cells or hemoglobin, indicating anemia."
HP:0005274,"the patient presented with a noticeable bulging tip of nose, a characteristic feature of a prominent nasal tip deformity."
HP:0006040,"the patient presented with a prolonged 2nd metacarpal, a condition characterized by an abnormally long second metacarpal bone in the hand."
HP:0000276,"the patient presented with a prolonged facial length, characterized by an unusually long face shape."
HP:0005487,the patient presented with a prominent metopic suture that was still visible due to a distinct metopic suture.
HP:0005575,"the patient presented with a rare case of hemolytic uremic syndrome, which was identified as shiga toxin-independent hus, characterized by the absence of shiga toxin-producing escherichia coli infection."
HP:0001177,"the patient presented with a rare congenital anomaly characterized by preaxial thumb duplication, resulting in the formation of an extra thumb on the radial side of the normal thumb."
HP:0004598,"the patient presented with a rare congenital anomaly characterized by supernumerary vertebral ossification centers, resulting in an abnormal spinal column configuration."
HP:0008358,"the patient presented with a rare genetic disorder characterized by elevated levels of hyperproline in their blood plasma, a condition known as hyperprolinemia."
HP:0003231,"the patient presented with a rare genetic disorder, characterized by elevated levels of tyrosine, a hallmark symptom of hypertyrosinemia."
HP:0000265,"the patient presented with a reddened mastoid area, indicative of acute mastoiditis."
HP:0004796,the patient presented with a severe gastrointestinal obstruction that required immediate surgical intervention.
HP:0007569,"the patient presented with a widespread, generalized eruption characterized by a cluster of small, yellowish, oily patches and scales on the face, scalp, and chest, consistent with a diagnosis of generalized seborrheic dermatitis."
HP:0000771,"the patient presented with abnormal mammary gland growth in men, a rare condition known as gynecomastia."
HP:0003239,"the patient presented with abnormally high urine phosphoethanolamine levels, indicating a potential underlying metabolic disorder."
HP:0002105,"the patient presented with acute respiratory tract bleeding, characterized by coughing up blood and hemoptysis."
HP:0004836,"the patient presented with an abnormal proliferation of promyelocytes, a characteristic feature of acute promyelocytic leukemia."
HP:0000119,the patient presented with an abnormality of the genitourinary system.
HP:0000870,"the patient presented with an elevated prolactin hormone level, indicating hyperprolactinemia."
HP:0000771,the patient presented with an enlarged male breast due to gynecomastia.
HP:0002040,"the patient presented with an enlarged vein in the esophagus, a condition known as esophageal varices."
HP:0000232,"the patient presented with an everted lower lip, characterized by a protrusion of the lower lip beyond its normal position."
HP:0000054,"the patient presented with an infantile penile length, characterized by an abnormally small penis diameter and length, which is a congenital anomaly that affects approximately 1% of newborn males."
HP:0006899,"the patient presented with an unusual congenital anomaly, characterized by the abnormal fusion of the cerebellar hemispheres."
HP:0005575,the patient presented with atypical hemolytic uremic syndrome characterized by complement activation and endothelial damage.
HP:0008513,the patient presented with bilateral conductive hearing loss.
HP:0001799,"the patient presented with brachyonychia, a rare genetic disorder characterized by short nails and cuticles."
HP:0001640,"the patient presented with cardiac hypertrophy, characterized by an enlarged heart muscle in response to chronic pressure overload."
HP:0001396,"the patient presented with cholestasis, characterized by a slowed or blocked flow of bile from the liver."
HP:0005520,"the patient presented with chronic disseminated intravascular coagulation , a persistent and debilitating condition characterized by widespread clotting abnormalities and a heightened risk of bleeding and thrombotic complications."
HP:0004746,"the patient presented with electrondense glomerular membrane deposits, a characteristic feature of dense deposit disease."
HP:0002150,"the patient presented with elevated calcium levels in their urine, indicating a possible diagnosis of hypercalciuria."
HP:0008288,"the patient presented with elevated glycine levels, indicative of a nonketotic hyperglycinemia."
HP:0003072,"the patient presented with elevated serum calcium levels, indicating a possible diagnosis of hypercalcemia."
HP:0003131,"the patient presented with elevated urinary cystine levels, indicating a diagnosis of cystinuria."
HP:0000771,"the patient presented with enlarged male breast tissue, a condition known as gynecomastia."
HP:0000771,"the patient presented with excessive breast tissue in males, a condition known as gynecomastia."
HP:0001520,the patient presented with excessive fetal size due to a diagnosis of macrosomia.
HP:0004943,"the patient presented with expedited arterial hardening, a condition characterized by accelerated atherosclerosis and increased cardiovascular risk."
HP:0002202,"the patient presented with fluid accumulation around the lungs, a condition known as pleural effusion."
HP:0001041,"the patient presented with flushed cheeks, indicating a likely case of rosacea."
HP:0001019,"the patient presented with generalized erythrodermia, characterized by a diffuse and intense redness of the skin."
HP:0005575,the patient presented with hemolytic uremic syndrome characterized by platelet activation and thrombosis.
HP:0001100,"the patient presented with heterochromia, characterized by having different colored eyes."
HP:0003072,"the patient presented with hypercalcemia, characterized by excessive calcium in their blood."
HP:0001900,the patient presented with increased hemoglobin levels.
HP:0004417,"the patient presented with intermittent claudication symptoms, characterized by recurring episodes of muscle cramping and weakness in the legs during exercise."
HP:0002580,"the patient presented with intestinal volvulus, a life-threatening condition characterized by twisting of the intestine that can lead to obstructive symptoms and even necrosis."
HP:0001663,"the patient presented with intractable ventricular fibrillation, requiring immediate cardiac intervention to restore a normal heart rhythm."
HP:0004784,"the patient presented with juvenile gastrointestinal polyposis, characterized by the presence of numerous juvenile polyps throughout the gastrointestinal tract."
HP:0002098,"the patient presented with laboured breathing, a symptom indicative of respiratory distress."
HP:0004244,"the patient presented with limited mobility due to the presence of an accessory scaphoid, which in some cases can restrict wrist movement and cause stiffness."
HP:0000256,"the patient presented with macrocephalus, characterized by an abnormally large head circumference."
HP:0004746,"the patient presented with membranoproliferative glomerulonephritis type ii, characterized by deposits of immunoglobulins and complement proteins in the mesangial and subendothelial regions of the glomeruli."
HP:0008180,the patient presented with mildly elevated creatine phosphokinase levels.
HP:0008180,the patient presented with mildly elevated creatine phosphokinase levels in their blood.
HP:0001875,"the patient presented with neutropenia, a condition characterized by an abnormally low count of neutrophils in the blood."
HP:0001562,"the patient presented with oligohydramnios, characterized by low levels of amniotic fluid."
HP:0001655,"the patient presented with persistent fetal heart communication, characterized by the presence of a persistent foramen ovale or patent foramen ovale, allowing for the free exchange of blood between the two upper chambers of the heart."
HP:0000786,"the patient presented with primary amenorrhea, characterized by the absence of menstruation due to a congenital defect in the reproductive system."
HP:0003890,the patient presented with prominent deltoid tuberosities exhibiting hypertrophy.
HP:0005261,"the patient presented with spontaneous joint bleeding, characterized by recurrent episodes of sudden and unexplained joint hemorrhage."
HP:0002040,"the patient presented with swollen veins in the lower esophagus, a condition known as esophageal varices."
HP:0002020,"the patient presented with symptoms of gastroesophageal reflux, characterized by frequent heartburn and regurgitation of food."
HP:0004386,the patient presented with symptoms of gastrointestinal inflammation.
HP:0002578,"the patient presented with symptoms of reduced stomach emptying, characterized by delayed gastric emptying and associated gastrointestinal complaints."
HP:0002023,"the patient presents with a congenital anomaly characterized by the failure of the anus to form, resulting in a imperforate anus."
HP:0003987,the patient presents with a fractured ulna.
HP:0001882,"the patient presents with a low white blood cell count, indicating a compromised immune system."
HP:0004244,"the patient presents with a navicular secondary, specifically an accessory scaphoid bone located in relation to the navicular bone in the foot."
HP:0000687,"the patient presents with a noticeable generalized dental spacing, characterized by a consistent and widespread lack of closure between the teeth."
HP:0000771,"the patient presents with a rare condition characterized by male breast enlargement, also known as gynecomastia."
HP:0004244,"the patient presents with a scaphoid variant, characterized by an accessory scaphoid bone that is abnormally related to the main scaphoid bone in the wrist."
HP:0001822,"the patient presents with a visibly widened first metatarsophalangeal joint, a characteristic feature of hallux valgus."
HP:0007874,"the patient presents with an almond-shaped palpebral fissure, characterized by a narrowed or triangular upper eyelid margin."
HP:0002831,"the patient presents with an excessive coccygeal length, characterized by an unusually long tailbone."
HP:0006315,"the patient presents with an isolated median incisor, a rare dental anomaly characterized by the presence of a single central incisor in the anterior midline of the mouth."
HP:0007750,"the patient presents with central foveal hypoplasia, characterized by the underdevelopment of the central fovea, resulting in impaired central vision."
HP:0006446,"the patient presents with chondromalacia patellae, a condition characterized by the softening and degeneration of the articular cartilage, exacerbated by the presence of a dysplastic patella."
HP:0002355,the patient presents with difficulty walking due to the problem.
HP:0006803,"the patient reported experiencing intense perceptual experiences, characterized by vivid hallucinations and distorted sensory perceptions."
HP:0006597,"the patient suffered from a paralyzed diaphragm, which made it difficult for them to breathe properly."
HP:0006855,"the patient suffered from a rare and debilitating condition characterized by progressive atrophy of the cerebellar vermis, leading to significant motor coordination and balance impairments."
HP:0005365,the patient suffered from a rare immunological disorder characterized by a severe absence of b cells in their immune system.
HP:0004395,"the patient suffered from a starvation-related disorder, characterized by severe malnutrition and related health complications."
HP:0001141,"the patient suffered from an extreme visual acuity reduction, resulting in severely impaired vision."
HP:0001686,"the patient suffered from aphonia, a sudden and unexplained loss of voice."
HP:0006516,"the patient suffered from extrinsic allergic alveolitis, a type of hypersensitivity pneumonitis caused by an allergic reaction to environmental antigens in the workplace."
HP:0001639,"the patient suffered from hypertrophic cardiomyopathy, characterized by an enlarged and thickened heart muscle."
HP:0002149,"the patient suffered from hyperuricemia, a condition characterized by excess uric acid in the bloodstream."
HP:0004395,the patient suffered from inadequate nourishment due to a prolonged period of malnutrition.
HP:0002121,"the patient suffered from petit mal seizures, characterized by brief, generalized tonic-clonic episodes of impaired consciousness."
HP:0001404,"the patient suffered from severe hepatic cellular necrosis, a condition characterized by the death of liver cells due to damage or injury."
HP:0003568,the patient suffering from phosphohexose isomerase deficiency exhibits impaired glucose metabolism and related symptoms.
HP:0007354,"the patient suffers from a noncurable degenerative disease of motor neurons, also known as amyotrophic lateral sclerosis ."
HP:0004818,"the patient suffers from chronic intravascular hemolysis, a hallmark symptom of paroxysmal nocturnal hemoglobinuria ."
HP:0004789,"the patient suffers from lactose intolerance, an inability to digest lactose in their diet."
HP:0002021,the patient underwent a pyloromyotomy surgery to relieve the symptoms of infantile hypertrophic pyloric stenosis.
HP:0002032,"the patient was born with a congenital esophageal atresia, a birth defect in which part of the esophagus did not develop."
HP:0007383,"the patient was born with a congenital localized skin absence, a rare congenital defect characterized by a small, circumscribed area of absent skin."
HP:0001696,"the patient was born with a rare condition known as situs inversus, where all of their internal organs are mirrored on the opposite side of their body from the typical anatomical location."
HP:0007707,"the patient was born with an inherited absence of crystalline lens, resulting in congenital aphakia."
HP:0008198,"the patient was born with congenital hypoparathyroidism, characterized by the complete absence of parathyroid glands at birth."
HP:0006277,"the patient was diagnosed with a benign pancreatic hyperplasia, characterized by an enlargement of the pancreas due to cell multiplication."
HP:0001647,"the patient was diagnosed with a bicuspid aortic valve, characterized by having two leaflets rather than the typical three found in a normal aortic valve."
HP:0005268,"the patient was diagnosed with a blighted ovum, a type of miscarriage where the fertilized egg fails to implant in the uterus."
HP:0002408,"the patient was diagnosed with a cerebral arteriovenous malformation , a congenital abnormality characterized by an abnormal connection between the arteries and veins in the brain."
HP:0005550,the patient was diagnosed with a chronic lymphocytic leukemia characterized by a neoplastic b-cell proliferation.
HP:0001638,"the patient was diagnosed with a disease of the heart muscle, also known as cardiomyopathy."
HP:0000853,"the patient was diagnosed with a goiter, characterized by an enlarged thyroid gland located in the neck."
HP:0006574,"the patient was diagnosed with a hepatic arteriovenous malformation , a rare congenital disorder characterized by abnormal connections between arteries and veins in the liver."
HP:0002079,"the patient was diagnosed with a hypoplastic corpus callosum, a congenital anomaly characterized by a partial or complete absence of the corpus callosum, which is the largest white matter structure in the brain."
HP:0001659,"the patient was diagnosed with a leaky aortic valve, characterized by a faulty valve that allows blood to flow backward through the aortic valve, resulting in a condition known as aortic regurgitation."
HP:0007354,"the patient was diagnosed with a neurodegenerative disorder affecting motor neurons, specifically amyotrophic lateral sclerosis."
HP:0006277,"the patient was diagnosed with a pancreas that exhibited excessive cell growth, a condition known as pancreatic hyperplasia."
HP:0003085,"the patient was diagnosed with a prolonged fibula, a condition characterized by an abnormally long fibula bone in the lower leg."
HP:0002865,the patient was diagnosed with a rare and aggressive form of medullary thyroid cancer that had metastasized to multiple lymph nodes in the neck.
HP:0002688,"the patient was diagnosed with a rare congenital anomaly characterized by the complete absence of frontal sinuses, which presented unique challenges in managing their respiratory and sinus-related symptoms."
HP:0005682,"the patient was diagnosed with a rare congenital anomaly, characterized by a fusion of the subtalar joint, resulting in limited ankle mobility and altered gait pattern."
HP:0002390,the patient was diagnosed with a spinal arteriovenous malformation .
HP:0001629,"the patient was diagnosed with a ventricular septal defect , a congenital heart condition characterized by an opening in the wall of the heart that separates the left and right ventricles."
HP:0004261,"the patient was diagnosed with a widened hamate, a condition characterized by an abnormally broad hamate bone that was evident on medical imaging and examination."
HP:0000845,"the patient was diagnosed with acromegaly, a rare condition characterized by hypersecretion of growth hormone, which had caused significant physical changes and health issues."
HP:0006733,"the patient was diagnosed with acute megakaryocytic leukemia, a malignant disorder of primitive megakaryoblasts."
HP:0004791,the patient was diagnosed with an esophagus ulcer.
HP:0001903,the patient was diagnosed with anemia due to a low number of red blood cells or haemoglobin.
HP:0008660,"the patient was diagnosed with aplasia of proximal renal tubules, a rare congenital disorder characterized by the underdevelopment or absence of the proximal renal tubules, a hallmark feature of renotubular dysgenesis."
HP:0001746,"the patient was diagnosed with asplenia, a medical condition characterized by the congenital or acquired absence of the spleen."
HP:0001674,"the patient was diagnosed with atrioventricular canal type heart disease, a congenital defect characterized by a hole in the wall of the heart that separates the upper and lower chambers."
HP:0006719,the patient was diagnosed with benign gastrointestinal tract tumors.
HP:0008711,"the patient was diagnosed with benign prostatic hyperplasia, a noncancerous prostate enlargement that commonly affects men as they age."
HP:0005944,"the patient was diagnosed with bilateral pulmonary agenesis, characterized by a lack of lung development on both sides."
HP:0005293,the patient was diagnosed with chronic venous insufficiency due to poorly functioning veins.
HP:0005520,"the patient was diagnosed with compensated disseminated intravascular coagulation , indicating that their body was able to partially counterbalance the coagulation disorder through various physiological mechanisms."
HP:0003131,"the patient was diagnosed with cystinuria, a rare genetic disorder characterized by the excretion of cystine crystals in the urine."
HP:0002020,"the patient was diagnosed with gastroesophageal reflux, characterized by the frequent and recurring episodes of stomach acid flowing back up into the esophagus."
HP:0004955,"the patient was diagnosed with generalized arterial tortuosity, characterized by abnormal curvature of the arteries throughout the body."
HP:0004955,"the patient was diagnosed with generalized twisted arteries, a rare condition characterized by abnormal twisting of the arteries throughout the body."
HP:0002937,"the patient was diagnosed with hemivertebrae, a congenital condition characterized by the partial absence of one or more vertebrae in the spine."
HP:0008232,"the patient was diagnosed with high fsh syndrome, characterized by abnormally elevated follicle-stimulating hormone levels in the blood."
HP:0000238,"the patient was diagnosed with hydrocephalus, a condition characterized by an excessive accumulation of cerebrospinal fluid in the brain."
HP:0003072,"the patient was diagnosed with hypercalcemia, a medical condition characterized by abnormally high blood calcium levels."
HP:0002153,"the patient was diagnosed with hyperkalemia, a condition characterized by excessive potassium in the blood."
HP:0003228,"the patient was diagnosed with hypernatremia, a condition characterized by abnormally high blood sodium levels."
HP:0003228,"the patient was diagnosed with hypernatremia, characterized by high sodium levels in the blood."
HP:0000870,"the patient was diagnosed with hyperprolactinemia, a condition characterized by an excessive production of prolactin in the pituitary gland."
HP:0003113,"the patient was diagnosed with hypochloremia, a condition characterized by a low concentration of chloride ions in their blood."
HP:0003113,"the patient was diagnosed with hypochloremia, a medical condition characterized by insufficient chloride in the blood."
HP:0008163,"the patient was diagnosed with hypocortisolism, characterized by a significantly low blood cortisol level."
HP:0002917,"the patient was diagnosed with hypomagnesemia, a condition characterized by low blood magnesium levels."
HP:0005233,"the patient was diagnosed with hypoplastic gallbladder, characterized by inadequate gallbladder growth."
HP:0003537,"the patient was diagnosed with hypouricemia, a condition characterized by insufficient uric acid in the blood."
HP:0008687,"the patient was diagnosed with inadequate prostate growth, also known as hypoplasia, which is a rare congenital condition characterized by an underdeveloped prostate gland."
HP:0004395,the patient was diagnosed with malnutrition due to insufficient nutrition.
HP:0004394,the patient was diagnosed with multiple gastric polyps.
HP:0006770,the patient was diagnosed with nonpapillary renal cell carcinoma.
HP:0001562,"the patient was diagnosed with oligohydramnios, a condition characterized by low amniotic fluid."
HP:0001561,"the patient was diagnosed with polyhydramnios, a condition characterized by excess amniotic fluid."
HP:0001561,"the patient was diagnosed with polyhydramnios, characterized by high levels of amniotic fluid in the womb."
HP:0031677,"the patient was diagnosed with polymorphic ventricular tachycardia, a type of abnormal heartbeat characterized by an irregular and varied pattern of ventricular contractions."
HP:0002516,"the patient was diagnosed with pseudotumor cerebri, a condition characterized by increased intracranial pressure without an underlying mass lesion or other cause."
HP:0006518,"the patient was diagnosed with pulmonary venoocclusive disease, a rare and complex condition characterized by the obstruction of small pulmonary veins."
HP:0002740,the patient was diagnosed with recurrent e. coli infections due to repeated bacterial invasions.
HP:0008488,"the patient was diagnosed with scheuermann's disease, a condition characterized by anterior rounding of vertebral bodies, which typically affects adolescents."
HP:0003057,"the patient was diagnosed with tetra-amelia syndrome, a rare congenital disorder characterized by the absence of all four limbs."
HP:0000211,"the patient was diagnosed with trismus, commonly referred to as lockjaw, due to the severe spasms in their masseter muscle."
HP:0000139,"the patient was diagnosed with uterine prolapse, characterized by uterine sagging due to weakened pelvic floor muscles and connective tissue."
HP:0002633,"the patient was diagnosed with vasculitis, an inflammation of the blood vessel."
HP:0004841,the patient with factor xii deficiency exhibited normal hemostasis and thrombosis.
HP:0004430,the patient with severe combined immunodeficiency disease was admitted to the hospital with a severe infection.
HP:0006516,"the patient, a 35-year-old farmer, was diagnosed with farmers' lung, a type of hypersensitivity pneumonitis caused by inhaling spores from moldy hay."
HP:0005184,"the patient, a 65-year-old woman, was diagnosed with a prolonged qtc interval, a cardiac condition that increases the risk of abnormal heart rhythms."
HP:0006533,"the patient, a premature infant, suffers from bronchodysplasia, a condition often linked to bronchopulmonary dysplasia, which increases the risk of respiratory complications and infections."
HP:0005876,"the patient, afflicted with progressive flexion contractures, exhibits severely restricted movement and a significantly reduced range of motion."
